{
  "schema_version": "0.1",
  "project": {
    "id": "porting-automation-tango-tmo",
    "name": "Porting Automation Tango TMO",
    "source": "UX-partner"
  },
  "flow": {
    "id": "submit-uk-mobile-esim-port-request",
    "name": "Submit UK Mobile-eSIM port request",
    "goal": "Admin submits a UK Mobile-eSIM port request without opening a manual support ticket.",
    "entry_point": "Port history > Port number",
    "success_exit": "Request submitted with order ID and Port history tracking entry."
  },
  "review_profiles": {
    "primary": "b2b-admin",
    "secondary": [
      "multi-step-workflow",
      "bulk-operations",
      "data-table",
      "async-status-tracking",
      "blocked-prerequisite-recovery"
    ],
    "excluded": [
      "consumer-onboarding",
      "marketing-site",
      "visual-brand-exploration"
    ],
    "confirmed_by_user": true,
    "confirmed_at": "2026-06-29"
  },
  "flow_ui_grammar": {
    "layout_patterns": [
      {
        "id": "wizard-decision-screen",
        "intent": "Single decision step with primary selector and secondary prerequisite guidance."
      },
      {
        "id": "bulk-workbench-screen",
        "intent": "Input and parsed results visible together for batch correction."
      },
      {
        "id": "blocked-prerequisite-screen",
        "intent": "Explain missing prerequisite, external exit, draft preservation, and return behavior."
      },
      {
        "id": "review-submit-screen",
        "intent": "Grouped review summary with risk warnings before final submit."
      },
      {
        "id": "status-entry-screen",
        "intent": "Show submitted state, next tracking action, and recovery entry points."
      }
    ],
    "component_families": [
      "step progress indicator",
      "selectable table/list",
      "bulk input with parsed preview",
      "per-item validation table",
      "grouped review summary",
      "blocked prerequisite callout",
      "external exit action",
      "save draft action",
      "status timeline"
    ]
  },
  "source_context": {
    "not_doing": [
      "business address creation",
      "subscriber creation",
      "KYC flow",
      "temporary number acquisition"
    ],
    "open_questions": [
      "US/TMO collection fields"
    ]
  },
  "screens": [
    {
      "id": "select-business-address",
      "title": "Select verified business address",
      "type": "wizard_step",
      "layout_pattern_id": "wizard-decision-screen",
      "source_trace": [
        {
          "source_file": "ux-onepage.md",
          "section": "16. 信息架构",
          "claim": "Select verified business address is a new step; no address uses prompt exit.",
          "source_type": "confirmed",
          "confidence": "high"
        }
      ],
      "user_intent": "Choose an already verified business address for the selected country.",
      "page_purpose": "Confirm required address prerequisite before collecting port-in details.",
      "content_structure": {
        "primary_section": "Verified address selector",
        "secondary_section": "Prerequisite guidance and blocked-state explanation"
      },
      "components": [
        {
          "id": "business-address-selector",
          "type": "table",
          "component_family": "selectable table/list",
          "role": "Let admin select a verified address.",
          "data": {
            "columns": [
              "Address",
              "Country",
              "Status",
              "Last updated"
            ],
            "row_actions": [
              "Select"
            ]
          },
          "states": [
            "default",
            "empty",
            "loading",
            "disabled"
          ],
          "content": {
            "label": "Verified business address"
          },
          "source_trace": [
            {
              "source_file": "decisions.md",
              "section": "D1",
              "claim": "Address prerequisite uses select-existing model.",
              "source_type": "decision",
              "confidence": "high"
            }
          ],
          "shadcn_target": {
            "strategy": "component",
            "targets": [
              "table",
              "button",
              "badge"
            ],
            "fallback": "component_composition_allowed",
            "notes": "No single shadcn block is required for the selector; compose table rows with clear selected and empty states."
          }
        }
      ],
      "interactions": [
        {
          "id": "continue-with-address",
          "trigger": "Click Continue",
          "condition": "A verified address is selected",
          "result": "Navigate to enter port-in numbers",
          "destination": "enter-port-in-numbers",
          "failure_behavior": "Stay on current screen and show inline selection validation.",
          "source_trace": [
            {
              "source_file": "ux-onepage.md",
              "section": "17. 交互流程",
              "claim": "Address selection continues to port-in number entry.",
              "source_type": "confirmed",
              "confidence": "high"
            }
          ]
        }
      ],
      "states": [
        {
          "id": "no-verified-address",
          "type": "blocked",
          "message": "No verified business address is available for this country.",
          "recovery": {
            "action": "Go to Business Address & Documents",
            "destination": "external-business-address-documents",
            "return_behavior": "Resume saved draft from Port history after verification."
          },
          "source_trace": [
            {
              "source_file": "decisions.md",
              "section": "D1/D4",
              "claim": "Missing address is an external prompt exit, not an in-flow creation screen.",
              "source_type": "decision",
              "confidence": "high"
            }
          ]
        }
      ],
      "validations": [
        {
          "id": "address-required",
          "rule": "A verified address must be selected.",
          "error": "Select a verified address to continue.",
          "recovery": "Select a row or use the external exit."
        }
      ],
      "prototype_instruction": "Show a verified-address selector and a blocked empty state that offers external exit plus draft return behavior. Include visible default, loading or error states, primary action behavior, and recovery affordances already defined in this JSON.",
      "out_of_scope_notes": [
        "Do not build address creation or KYC flow."
      ],
      "needs_confirmation": [],
      "path_role": "happy_path_step"
    },
    {
      "id": "enter-port-in-numbers",
      "title": "Enter port-in numbers",
      "type": "wizard_step",
      "layout_pattern_id": "bulk-workbench-screen",
      "source_trace": [
        {
          "source_file": "ux-onepage.md",
          "section": "16. 信息架构",
          "claim": "Port-in numbers are entered before pre-check.",
          "source_type": "confirmed",
          "confidence": "high"
        }
      ],
      "user_intent": "Enter one or many UK Mobile-eSIM numbers to port.",
      "page_purpose": "Capture bulk numbers and prepare them for per-item validation.",
      "content_structure": {
        "primary_section": "Parsed number preview",
        "secondary_section": "Bulk input"
      },
      "components": [
        {
          "id": "number-bulk-input",
          "type": "textarea",
          "component_family": "bulk input with parsed preview",
          "role": "Capture many numbers while previewing parsed rows.",
          "data": {
            "accepted_input": "one number per line or pasted list"
          },
          "states": [
            "default",
            "validation_error"
          ],
          "content": {
            "label": "Port-in numbers"
          },
          "shadcn_target": {
            "strategy": "component",
            "targets": [
              "textarea",
              "form",
              "alert"
            ],
            "fallback": "component_composition_allowed",
            "notes": "Use textarea for pasted numbers with adjacent parsed feedback."
          }
        },
        {
          "id": "number-preview-table",
          "type": "table",
          "component_family": "per-item validation table",
          "role": "Show parsed numbers and per-item validation status.",
          "data": {
            "columns": [
              "Number",
              "Format",
              "Duplicate",
              "Eligibility",
              "Status"
            ]
          },
          "states": [
            "default",
            "empty",
            "error"
          ],
          "shadcn_target": {
            "strategy": "component",
            "targets": [
              "table",
              "badge",
              "button"
            ],
            "fallback": "component_composition_allowed",
            "notes": "Show row-level status and correction actions."
          }
        }
      ],
      "interactions": [
        {
          "id": "run-number-precheck",
          "trigger": "Click Continue",
          "condition": "At least one parseable number exists",
          "result": "Run pre-check and navigate to pre-check result",
          "destination": "number-precheck-result",
          "failure_behavior": "Stay on screen and mark invalid rows."
        }
      ],
      "states": [
        {
          "id": "number-format-error",
          "type": "error",
          "message": "Some numbers need correction before pre-check.",
          "recovery": {
            "action": "Edit affected rows",
            "destination": "stay_on_current_screen"
          }
        }
      ],
      "validations": [
        {
          "id": "per-item-number-validation",
          "rule": "Each row must be parseable and not duplicated.",
          "error": "Show row-level error.",